id,created_at,text
824080768364408832,2017-01-25 02:25:40,"If Chicago doesn't fix the horrible ""carnage"" going on, 228 shootings in 2017 with 42 killings (up 24% from 2016), I will send in the Feds!"
824078419159904258,2017-01-25 02:16:20,Congratulations to @FoxNews for being number one in inauguration ratings. They were many times higher than FAKE NEWS @CNN - public is smart!
823850783212994560,2017-01-24 11:11:47,Will be meeting at 9:00 with top automobile executives concerning jobs in America. I want new plants to be built here for cars sold here!
823495060494962688,2017-01-23 11:38:16,Busy week planned with a heavy focus on jobs and national security. Top executives coming in at 9:00 A.M. to talk manufacturing in America.
823174200320028672,2017-01-22 14:23:17,"Peaceful protests are a hallmark of our democracy. Even if I don't always agree, I recognize the rights of people to express their views."
823151126128328705,2017-01-22 12:51:36,"Wow, television ratings just out: 31 million people watched the Inauguration, 11 million more than the very good ratings from 4 years ago!"
823150056626946048,2017-01-22 12:47:21,Watched protests yesterday but was under the impression that we just had an election! Why didn't these people vote? Celebs hurt cause badly.
823146988799721473,2017-01-22 12:35:10,"Had a great meeting at CIA Headquarters yesterday, packed house, paid great respect to Wall, long standing ovations, amazing people. WIN!"
822850743845748737,2017-01-21 16:57:59,"I am honered to serve you, the great American People, as your 45th President of the United States!"
822774163278598144,2017-01-21 11:53:41,A fantastic day and evening in Washington D.C.Thank you to @FoxNews and so many other news outlets for the GREAT reviews of the speech!
822421391941238784,2017-01-20 12:31:54,It all begins today! I will see you at 11:00 A.M. for the swearing-in. THE MOVEMENT CONTINUES - THE WORK BEGINS!
822176439919316992,2017-01-19 20:18:33,Great Concert at 4:00 P.M. today at Lincoln Memorial. Enjoy!
822066655647977472,2017-01-19 13:02:18,"the American people. I have no doubt that we will, together, MAKE AMERICA GREAT AGAIN!"
822066133763293184,2017-01-19 13:00:14,"Getting ready to leave for Washington, D.C. The journey begins and I will be working and fighting very hard to make it a great journey for.."
822064154890604544,2017-01-19 12:52:22,"""It wasn't Donald Trump that divided this country, this country has been divided for a long time!"" Stated today by Reverend Franklin Graham."
821719764519256065,2017-01-18 14:03:53,.@TheAlabamaBand was great last night in D.C. playing for 147 Diplomats and Ambassadors from countries around the world. Thanks Alabama!
821705441499611136,2017-01-18 13:06:58,No wonder the Today Show on biased @NBC is doing so badly compared to its glorious past. Little credibility!
821703904308199424,2017-01-18 13:00:51,"""Bayer AG has pledged to add U.S. jobs and investments after meeting with President-elect Donald Trump, the latest in a string..."" @WSJ"
821699673975091200,2017-01-18 12:44:03,"to the U.S., but had nothing to do with TRUMP, is more FAKE NEWS. Ask top CEO's of those companies for real facts. Came back because of me!"
821686930295390208,2017-01-18 11:53:25,Will be interviewed by @ainsleyearhardt on @foxandfriends - Enjoy!
821369653385658368,2017-01-17 14:52:40,"""thought it would be hypocritical to attend Bush's swearing-in....he doesn't believe Bush is the true elected president."" Sound familiar! WP"
821368090185318401,2017-01-17 14:46:27,"John Lewis said about my inauguration, ""It will be the first one that I've missed."" WRONG (or lie)! He boycotted Bush 43 also because he..."
821365570402709505,2017-01-17 14:36:26,"country and with the massive cost reductions I have negotiated on military purchases and more, I believe the people are seeing ""big stuff."""
821364028689842176,2017-01-17 14:30:19,"With all of the jobs I am bringing back into the U.S. (even before taking office), with all of the new auto plants coming back into our....."
821344303763038208,2017-01-17 13:11:56,"The same people who did the phony election polls, and were so wrong, are now doing approval rating polls. They are rigged just like before."
821342602079440896,2017-01-17 13:05:10,"People are pouring into Washington in record numbers. Bikers for Trump are on their way. It will be a great Thursday, Friday and Saturday!"
821177309008891904,2017-01-17 02:08:21,"""@drgoodspine: @realDonaldTrump @Ivanka Trump is great, a woman with real character and class."""
821172597157220352,2017-01-17 01:49:38,"At 9:00 P.M. @CNN, of all places, is doing a Special Report on my daughter, Ivanka. Considering it is CNN, can't imagine it will be great!"
821170752946896899,2017-01-17 01:42:18,"""@levisteveholt: @realDonaldTrump I appreciate your use of Twitter to keep us informed and maintain transparency."" Very dishonest media!"
820992722412642305,2017-01-16 13:54:52,Celebrate Martin Luther King Day and all of the many wonderful things that he stood for. Honor him for being the great man that he was!
820789940137197569,2017-01-16 00:29:05,"much worse - just look at Syria (red line), Crimea, Ukraine and the build-up of Russian nukes. Not good! Was this the leaker of Fake News?"
820786731628761089,2017-01-16 00:16:20,".@FoxNews ""Outgoing CIA Chief, John Brennan, blasts Pres-Elect Trump on Russia threat. Does not fully understand."" Oh really, couldn't do..."
820764136128872454,2017-01-15 22:46:33,".@NBCNews is bad but Saturday Night Live is the worst of NBC. Not funny, cast is terrible, always a complete hit job. Really bad television!"
820723389715378176,2017-01-15 20:04:39,"Thank you to Bob Woodward who said, ""That is a garbage document...it never should have been presented...Trump's right to be upset (angry)..."
820707212423266305,2017-01-15 19:00:22,"For many years our country has been divided, angry and untrusting. Many say it will never change, the hatred is too deep. IT WILL CHANGE!!!!"
820632300622934016,2017-01-15 14:02:41,"will only get higher. Car companies and others, if they want to do business in our country, have to start making things here again. WIN!"
820631497522692101,2017-01-15 13:59:30,"The Democrats are most angry that so many Obama Democrats voted for me. With all of the jobs I am bringing back to our Nation, that number.."
820450167828742146,2017-01-15 01:58:57,"Inauguration Day is turning out to be even bigger than expected. January 20th, Washington D.C. Have fun!"
820425772276084736,2017-01-15 00:22:01,Congressman John Lewis should finally focus on the burning and crime infested inner-cities of the U.S. I can use all the help I can get!
820257716073615360,2017-01-14 13:14:13,"INTELLIGENCE INSIDERS NOW CLAIM THE TRUMP DOSSIER IS ""A COMPLETE FRAUD!""  @OANN"
820255949663375360,2017-01-14 13:07:12,"mention crime infested) rather than falsely complaining about the election results. All talk, talk, talk - no action or results. Sad!"
820251732131332096,2017-01-14 12:50:27,"Congressman John Lewis should spend more time on fixing and helping his district, which is in horrible shape and falling apart (not to......"
819869955118235649,2017-01-13 11:33:24,"The ""Unaffordable"" Care Act will soon be history!"
819868068021227525,2017-01-13 11:25:54,have been allowed to run - guilty as hell. They were VERY nice to her. She lost because she campaigned in the wrong states - no enthusiasm!
819867247984394241,2017-01-13 11:22:38,What are Hillary Clinton's people complaining about with respect to the F.B.I. Based on the information they had she should never.....
819865805215166464,2017-01-13 11:16:54,"released by ""Intelligence"" even knowing there is no proof, and never will be. My people will have a full report on hacking within 90 days!"
819864375448244224,2017-01-13 11:11:14,"Totally made up facts by sleazebag political operatives, both Democrats and Republicans - FAKE NEWS! Russia says nothing exists. Probably..."
819863041395277824,2017-01-13 11:05:56,It now turns out that the phony allegations against me were put together by my political opponents and a failed spy afraid of being sued....
819858928121085952,2017-01-13 10:49:35,"All of my Cabinet nominee are looking good and doing a great job. I want them to be themselves and express their own thoughts, not mine!"
819550084987813888,2017-01-12 14:22:21,.@CNN is in a total meltdown with their FAKE NEWS because their ratings are tanking since election and their credibility will soon be gone!
819541999527272451,2017-01-12 13:50:13,Thank you to Linda Bean of L.L.Bean for your great support and courage. People will support you even more now. Buy L.L.Bean. @LBPerfectMaine
819520240275038209,2017-01-12 12:23:45,"James Clapper called me yesterday to denounce the false and fictitious report that was illegally circulated. Made up, phony facts.Too bad!"
819399725342408704,2017-01-12 04:24:52,"""@zhu_amy3: @realDonaldTrump It's Morning in America again!!!  ☀️☀️☀️Thank you President-Elect Donald Trump!!! So proud of you!!!!"" THANKS!"
819393878608453633,2017-01-12 04:01:38,We had a great News Conference at Trump Tower today. A couple of FAKE NEWS organizations were there but the people truly get what's going on
819164174014148608,2017-01-11 12:48:53,"Intelligence agencies should never have allowed this fake news to ""leak"" into the public. One last shot at me.Are we living in Nazi Germany?"
819162970055909379,2017-01-11 12:44:06,"I win an election easily, a great ""movement"" is verified, and crooked opponents try to belittle our victory with FAKE NEWS. A sorry state!"
819159808007872512,2017-01-11 12:31:32,"Russia has never tried to use leverage over me. I HAVE NOTHING TO DO WITH RUSSIA - NO DEALS, NO LOANS, NO NOTHING!"
819155313408479232,2017-01-11 12:13:40,"Russia just said the unverified report paid for by political opponents is ""A COMPLETE AND TOTAL FABRICATION, UTTER NONSENSE."" Very unfair!"
818990656748187648,2017-01-11 01:19:23,FAKE NEWS - A TOTAL POLITICAL WITCH HUNT!
818460864634322944,2017-01-09 14:14:11,"It's finally happening - Fiat Chrysler just announced plans to invest $1BILLION in Michigan and Ohio plants, adding 2000 jobs. This after..."
818422931437092864,2017-01-09 11:43:27,"""groveling"" when he totally changed a 16 year old story that he had written in order to make me look bad. Just more very dishonest media!"
818421068327161856,2017-01-09 11:36:02,"Hillary flunky who lost big. For the 100th time, I never ""mocked"" a disabled reporter (would never do that) but simply showed him......."
818419003899125760,2017-01-09 11:27:50,"Meryl Streep, one of the most over-rated actresses in Hollywood, doesn't know me but attacked last night at the Golden Globes. She is a....."
818416447953178624,2017-01-09 11:17:41,Rupert Murdoch is a great guy who likes me much better as a very successful candidate than he ever did as a very successful developer!
818307690740981761,2017-01-09 04:05:31,Dishonest media says Mexico won't be paying for the wall if they pay a little later so the wall can be built more quickly. Media is fake!
818169486545129472,2017-01-08 18:56:21,"Before I, or anyone, saw the classified and/or highly confidential hacking intelligence report, it was leaked out to @NBCNews. So serious!"
818136715894423552,2017-01-08 16:46:07,Kellyanne Conway went to @MeetThePress this morning for an interview with @chucktodd. Dishonest media cut out 9 of her 10 minutes. Terrible!
818134982715699201,2017-01-08 16:39:14,"""@FoxNews: ""We certainly don’t want intelligence interfering with politics and we don’t want politics interfe… https://t.co/5ONf5EQJxv"""
818134362394947585,2017-01-08 16:36:46,"""@KellyannePolls: Welcome to President and Mrs. Bush.  
https://t.co/YF2UB3UNal"" Very nice!"
817915517210165250,2017-01-08 02:07:10,"I look very much forward to meeting Prime Minister Theresa May in Washington in the Spring. Britain, a longtime U.S. ally, is very special!"
817753084990472197,2017-01-07 15:21:43,"both countries will, perhaps, work together to solve some of the many great and pressing problems and issues of the WORLD!"
817750331836743680,2017-01-07 15:10:46,"have enough problems around the world without yet another one. When I am President, Russia will respect us far more than they do now and...."
817749055119958016,2017-01-07 15:05:42,"we have enough problems around the world without yet another one. When I am President, Russia will respect us far more than they do now....."
817748209145708544,2017-01-07 15:02:20,"Having a good relationship with Russia is a good thing, not a bad thing. Only ""stupid"" people, or fools, would think that it is bad! We....."
817703210060312576,2017-01-07 12:03:32,Only reason the hacking of the poorly defended DNC is discussed is that the loss by the Dems was so big that they are totally embarrassed!
817701437811605504,2017-01-07 11:56:29,Intelligence stated very strongly there was absolutely no evidence that hacking affected the election results. Voting machines not touched!
817579927293886464,2017-01-07 03:53:39,Gross negligence by the Democratic National Committee allowed hacking to take place.The Republican National Committee had strong defense!
817348646438141952,2017-01-06 12:34:37,"Wow, the ratings are in and Arnold Schwarzenegger got ""swamped"" (or destroyed) by comparison to the ratings machine, DJT. So much for...."
817341198234947585,2017-01-06 12:05:01,"Hopefully, all supporters, and those who want to MAKE AMERICA GREAT AGAIN, will go to D.C. on January 20th. It will be a GREAT SHOW!"
817336357097971712,2017-01-06 11:45:47,and knew they were in big trouble - which is why they cancelled their big fireworks at the last minute.THEY SAW A MOVEMENT LIKE NEVER BEFORE
817334796569415680,2017-01-06 11:39:35,Hillary and the Dems were never going to beat the PASSION of my voters. They saw what was happening in the last two weeks before the......
817329824956108802,2017-01-06 11:19:50,"The dishonest media does not report that any money spent on building the Great Wall (for sake of speed), will be paid back by Mexico later!"
817328259679522816,2017-01-06 11:13:36,"The dishonest media is not reporting that any money spent, for the sake if speed, on building the Great Wall, will be paid back by Mexico."
817168819823185921,2017-01-06 00:40:03,So how and why are they so sure about hacking if they never even requested an examination of the computer servers? What is going on?
817166354558177285,2017-01-06 00:30:15,The Democratic National Committee would not allow the FBI to study or see its computer info after it was supposedly hacked by Russia......
817164925097410560,2017-01-06 00:24:34,"How did NBC get ""an exclusive look into the top secret report he (Obama) was presented?"" Who gave them this report and why? Politics!"
817071793957642240,2017-01-05 18:14:30,"Toyota Motor said will build a new plant in Baja, Mexico, to build Corolla cars for U.S. NO WAY! Build plant in U.S. or pay big border tax."
817004211653279745,2017-01-05 13:45:57,"to make up their own minds as to the truth. The media lies to make it look like I am against ""Intelligence"" when in fact I am a big fan!"
816999063795232769,2017-01-05 13:25:30,"The dishonest media likes saying that I am in Agreement with Julian Assange - wrong. I simply state what he states, it is for the people...."
816977939141132289,2017-01-05 12:01:34,"...do the typical political thing and BLAME. The fact is ObamaCare was a lie from the beginning.""Keep you doctor, keep your plan!"" It is...."
816977034282987520,2017-01-05 11:57:58,"The Democrats, lead by head clown Chuck Schumer, know how bad ObamaCare is and what a mess they are in. Instead of working to fix it, they.."
816652090143547392,2017-01-04 14:26:45,massive increases of ObamaCare will take place this year and Dems are to blame for the mess. It will fall of its own weight - be careful!
816645833424633856,2017-01-04 14:01:53,"like the 116% hike in Arizona. Also, deductibles are so high that it is practically useless. Don't let the Schumer clowns out of this web..."
816644323018231808,2017-01-04 13:55:53,"Republicans must be careful in that the Dems own the failed ObamaCare disaster, with its poor coverage and massive premium increases......"
816638195865714688,2017-01-04 13:31:32,"things they did and said (like giving the questions to the debate to H). A total double standard! Media, as usual, gave them a pass."
816637066020876292,2017-01-04 13:27:03,"Somebody hacked the DNC but why did they not have ""hacking defense"" like the RNC has and why have they not responded to the terrible......"
816635079455887360,2017-01-04 13:19:09,Thank you to Ford for scrapping a new plant in Mexico and creating 700 new jobs in the U.S. This is just the beginning - much more to follow
816632795414073345,2017-01-04 13:10:05,"""@FoxNews: Julian Assange on U.S. media coverage: “It’s very dishonest.” #Hannity https://t.co/fGGdVIFf2Y"" More dishonest than anyone knows"
816620857162403840,2017-01-04 12:22:39,"Julian Assange said ""a 14 year old could have hacked Podesta"" - why was DNC so careless? Also said Russians did not give him the info!"
816619024503152640,2017-01-04 12:15:22,"Julian Assuage said ""a 14 year old could have hacked Podesta"" - why was DNC so careless? Also said it was not the Russians who gave info!"
816452808375435264,2017-01-04 01:14:53,"The ""Intelligence"" briefing on so-called ""Russian hacking"" was delayed until Friday, perhaps more time needed to build a case. Very strange!"
816433592209383424,2017-01-03 23:58:31,I will be having a general news conference on JANUARY ELEVENTH in N.Y.C. Thank you.
816333481781432320,2017-01-03 17:20:43,There should be no further releases from Gitmo. These are extremely dangerous people and should not be allowed back onto the battlefield.
816300004818165761,2017-01-03 15:07:41,"........may be, their number one act and priority. Focus on tax reform, healthcare and so many other things of far greater importance! #DTS"
816298945731235842,2017-01-03 15:03:29,"With all that Congress has to work on, do they really have to make the weakening of the Independent Ethics Watchdog, as unfair as it"
816265670438645760,2017-01-03 12:51:15,"The Democrat Governor.of Minnesota said ""The Affordable Care Act (ObamaCare) is no longer affordable!"" - And, it is lousy healthcare."
816264485950332928,2017-01-03 12:46:33,"People must remember that ObamaCare just doesn't work, and it is not affordable - 116% increases (Arizona). Bill Clinton called it ""CRAZY"""
816260345207590913,2017-01-03 12:30:06,General Motors is sending Mexican made model of Chevy Cruze to U.S. car dealers-tax free across border. Make in U.S.A.or pay big border tax!
816057921754845188,2017-01-02 23:05:44,North Korea just stated that it is in the final stages of developing a nuclear weapon capable of reaching parts of the U.S. It won't happen!
815992071135916032,2017-01-02 18:44:04,"I thought and felt I would win big, easily over the fabled 270 (306). When they cancelled fireworks, they knew, and so did I."
815990336812122112,2017-01-02 18:37:11,"Various media outlets and pundits say that I thought I was going to lose the election. Wrong, it all came together in the last week and....."
815973754153136128,2017-01-02 17:31:17,"Chicago murder rate is record setting - 4,331 shooting victims with 762 murders in 2016. If Mayor can't do it he must ask for Federal help!"
815930690495778816,2017-01-02 14:40:10,"Well, the New Year begins. We will, together, MAKE AMERICA GREAT AGAIN!"
815185072689127425,2016-12-31 13:17:21,"Happy New Year to all, including to my many enemies and those who have fought me and lost so badly they just don't know what to do. Love!"
814958822678794240,2016-12-30 22:18:19,"Russians are playing @CNN and @NBCNews for such fools - funny to watch, they don't have a clue! @FoxNews totally gets it!"
814919372221333504,2016-12-30 19:41:33,Great move on delay (by V. Putin) - I always knew he was very smart!
814114982417879042,2016-12-28 14:25:11,"not anymore. The beginning of the end was the horrible Iran deal, and now this (U.N.)! Stay strong Israel, January 20th is fast approaching!"
814113617398337536,2016-12-28 14:19:46,"We cannot continue to let Israel be treated with such total disdain and disrespect. They used to have a great friend in the U.S., but......."
814110462157717505,2016-12-28 14:07:14,Doing my best to disregard the many inflammatory President O statements and roadblocks.Thought it was going to be a smooth transition - NOT!
813945098182524928,2016-12-28 03:10:08,"The U.S. Consumer Confidence Index for December surged nearly four points to 113.7, THE HIGHEST LEVEL IN MORE THAN 15 YEARS! Thanks Donald!"
813865161836687361,2016-12-27 21:52:30,"President Obama campaigned hard (and personally) in the very important swing states, and lost.The voters wanted to MAKE AMERICA GREAT AGAIN!"
813581918721732609,2016-12-27 03:06:59,"The DJT Foundation, unlike most foundations, never paid fees, rent, salaries or any expenses. 100% of money goes to wonderful charities!"
813578485977509888,2016-12-27 02:53:21,"I gave millions of dollars to DJT Foundation, raised or recieved millions more, ALL of which is given to charity, and media won't report!"
813500124534079492,2016-12-26 21:41:58,"The United Nations has such great potential but right now it is just a club for people to get together, talk and have a good time. So sad!"
813498741567037440,2016-12-26 21:36:28,"President Obama said that he thinks he would have won against me. He should say that but I say NO WAY! - jobs leaving, ISIS, OCare, etc."
813079060226121728,2016-12-25 17:48:48,"Merry Christmas and a very, very, very , very Happy New Year to everyone!"
812815405467176960,2016-12-25 00:21:08,".@FoxNews - ""Objectified"" tonight at 10:00 P.M. Enjoy!"
812773206213988352,2016-12-24 21:33:27,"The big loss yesterday for Israel in the United Nations will make it much harder to negotiate peace.Too bad, but we will get it done anyway!"
812764664253792256,2016-12-24 20:59:31,".@NBCNews purposely left out this part of my nuclear qoute: ""until such time as the world comes to its senses regarding nukes.""  Dishonest!"
812450978091986945,2016-12-24 00:13:02,"Vladimir Putin said today about Hillary and Dems: ""In my opinion, it is humiliating. One must be able to lose with dignity.""  So true!"
812408190755291136,2016-12-23 21:23:01,"slaughter you. This is a purely religious threat, which turned into reality. Such hatred! When will the U.S., and all countries, fight back?"
812406856815673344,2016-12-23 21:17:43,"The terrorist who killed so many people in Germany said just before crime, ""by God's will we will slaughter you pigs, I swear, we will......"
812266154278391808,2016-12-23 11:58:37,"my presidency. Isn't this a ridiculous shame? He loves these kids, has raised millions of dollars for them, and now must stop. Wrong answer!"
812264764684570624,2016-12-23 11:53:05,"My wonderful son, Eric, will no longer be allowed to raise money for children with cancer because of a possible conflict of interest with..."
812115503145766915,2016-12-23 01:59:58,"The so-called ""A"" list celebrities are all wanting tixs to the inauguration, but look what they did for Hillary, NOTHING. I want the PEOPLE!"
812061678540062720,2016-12-22 22:26:06,"Based on the tremendous cost and cost overruns of the Lockheed Martin F-35, I have asked Boeing to price-out a comparable F-18 Super Hornet!"
811977224702279680,2016-12-22 16:50:30,The United States must greatly strengthen and expand its nuclear capability until such time as the world comes to its senses regarding nukes
811975051046244353,2016-12-22 16:41:52,"Someone incorrectly stated that the phrase ""DRAIN THE SWAMP"" was no longer being used by me. Actually, we will always be trying to DTS."
811778177530036224,2016-12-22 03:39:34,"I met some really great Air Force GENERALS and Navy ADMIRALS today, talking about airplane capability and pricing. Very impressive people!"
811564285986013185,2016-12-21 13:29:38,I have not heard any of the pundits or commentators discussing the fact that I spent FAR LESS MONEY on the win than Hillary on the loss!
811562992060026881,2016-12-21 13:24:30,"I would have done even better in the election, if that is possible, if the winner was based on popular vote - but would campaign differently"
811555415477616640,2016-12-21 12:54:23,"Campaigning for votes under the Electoral College system is much more difficult, and different, than the popular vote."
811307170339966976,2016-12-20 20:27:57,"Yes, it is true - Carlos Slim, the great businessman from Mexico, called me about getting together for a meeting. We met, HE IS A GREAT GUY!"
811196780272558080,2016-12-20 13:09:18,"especially how to get people, even with an unlimited budget, out to vote in the vital swing states ( and more). They focused on wrong states"
811195443405324290,2016-12-20 13:03:59,"Bill Clinton stated that I called him after the election. Wrong, he called me (with a very nice congratulations). He ""doesn't know much"" ..."
810996053503803392,2016-12-19 23:51:41,"We did it! Thank you to all of my great supporters, we just officially won the election (despite all of the distorted and inaccurate media)."
810988380653809664,2016-12-19 23:21:12,"Today there were terror attacks in Turkey, Switzerland and Germany - and it is only getting worse. The civilized world must change thinking!"
810288323197632512,2016-12-18 00:59:25,We should tell China that we don't want the drone they stole back.- let them keep it!
810112408819761152,2016-12-17 13:20:24,"Mobile, Alabama today at 3:00 P.M. Last rally of the year - ""THANK YOU ALABAMA AND THE SOUTH"" Biggest of all crowds expected, see you there!"
