id,created_at,text
845646763201630209,2017-03-25 14:41:14,Watch @JudgeJeanine on @FoxNews tonight at 9:00 P.M.
845645918422667266,2017-03-25 14:37:52,ObamaCare will explode and we will all get together and piece together a great healthcare plan for THE PEOPLE. Do not worry!
839448470742269954,2017-03-08 12:11:26,LinkedIn Workforce Report: January and February were the strongest consecutive months for hiring since August and September 2015
839116943286235138,2017-03-07 14:14:03,"Don't let the FAKE NEWS tell you that there is big infighting in the Trump Admin. We are getting along great, and getting major things done!"
839110002245791744,2017-03-07 13:46:29,I am working on a new system where there will be competition in the Drug Industry. Pricing for the American people will come way down!
839108869838241794,2017-03-07 13:41:59,"Don't worry, getting rid of state lines, which will promote competition, will be in phase 2 &amp;amp; 3 of healthcare rollout. @foxandfriends"
839101662937628672,2017-03-07 13:13:20,"For eight years Russia ""ran over"" President Obama, got stronger and stronger, picked-off Crimea and added missiles. Weak! @foxandfriends"
839086724861014016,2017-03-07 12:13:59,Our wonderful new Healthcare Bill is now out for review and negotiation. ObamaCare is a complete and total disaster - is imploding fast!
839084270303989760,2017-03-07 12:04:14,"122 vicious prisoners, released by the Obama Administration from Gitmo, have returned to the battlefield. Just another terrible decision!"
838353483069800449,2017-03-05 11:40:20,"Who was it that secretly said to Russian President, ""Tell Vladimir that after the election I'll have more flexibility?"" @foxandfriends"
838351477823406081,2017-03-05 11:32:22,Is it true the DNC would not allow the FBI access to check server or other equipment after learning it was hacked? Can that be possible?
838016046728622081,2017-03-04 13:19:29,"Arnold Schwarzenegger isn't voluntarily leaving the Apprentice, he was fired by his bad (pathetic) ratings, not by me. Sad end to great show"
837996747557306369,2017-03-04 12:02:48,How low has President Obama gone to tapp my phones during the very sacred election process. This is Nixon/Watergate. Bad (or sick) guy!
837994259051589632,2017-03-04 11:52:55,"I'd bet a good lawyer could make a great case out of the fact that President Obama was tapping my phones in October, just prior to Election!"
837993275017441285,2017-03-04 11:49:00,"Is it legal for a sitting President to be ""wire tapping"" a race for president prior to an election? Turned down by court earlier. A NEW LOW!"
837991760353718272,2017-03-04 11:42:59,"Just out: The same Russian Ambassador that met Jeff Sessions visited the Obama White House 22 times, and 4 times last year alone."
837989837030440962,2017-03-04 11:35:20,"Terrible! Just found out that Obama had my ""wires tapped"" in Trump Tower just before the victory. Nothing found. This is McCarthyism!"
837987685927174150,2017-03-04 11:26:48,The first meeting Jeff Sessions had with the Russian Amb was set up by the Obama Administration under education program for 100 Ambs......
837638491580280833,2017-03-03 12:19:13,It is so pathetic that the Dems have still not approved my full Cabinet.
837633822015569921,2017-03-03 12:00:40,"Nick Adams new book, Green Card Warrior, is a must read. The merit-based system is the way to go. Canada, Australia! @foxandfriends"
837492426805817344,2017-03-03 02:38:49,"...is all of the illegal leaks of classified and other information. It is a total ""witch hunt!"""
837491608765480964,2017-03-03 02:35:34,"...to win. The Democrats are overplaying their hand. They lost the election, and now they have lost their grip on reality. The real story..."
837489579577991169,2017-03-03 02:27:30,...intentional. This whole narrative is a way of saving face for Democrats losing an election that everyone thought they were supposed.....
837488403901988866,2017-03-03 02:22:49,"Jeff Sessions is an honest man. He did not say anything wrong. He could have stated his response more accurately, but it was clearly not...."
837256339495714816,2017-03-02 11:00:41,"Since November 8th, Election Day, the Stock Market has posted $3.2 trillion in GAINS and consumer confidence is at a 15 year high. Jobs!"
836933727158689792,2017-03-01 13:38:44,THANK YOU!
836406329728253953,2017-02-28 02:43:03,I will be interviewed on @foxandfriends at 6:00 A.M. Enjoy!
835946003211685888,2017-02-26 20:13:52,"Big dinner with Governors tonight at White House. Much to be discussed, including healthcare."
835916513211187200,2017-02-26 18:16:41,"Russia talk is FAKE NEWS put out by the Dems, and played up by the media, in order to mask the big election defeat and the illegal leaks!"
835817352373669888,2017-02-26 11:42:40,For first time the failing @nytimes will take an ad (a bad one) to help save its failing reputation. Try reporting accurately &amp;amp; fairly!
835814990418432002,2017-02-26 11:33:17,"The race for DNC Chairman was, of course, totally ""rigged."" Bernie's guy, like Bernie himself, never had a chance. Clinton demanded Perez!"
835610918746750977,2017-02-25 22:02:22,"Congratulations to Thomas Perez, who has just been named Chairman of the DNC. I could not be happier for him, or for the Republican Party!"
835608649938644992,2017-02-25 21:53:21,I will not be attending the White House Correspondents' Association Dinner this year. Please wish everyone well and have a great evening!
835479285251076096,2017-02-25 13:19:18,The media has not reported that the National Debt in my first month went down by $12 billion vs a $200 billion increase in Obama first mo.
835465721857601536,2017-02-25 12:25:24,Maybe the millions of people who voted to MAKE AMERICA GREAT AGAIN should have their own rally. It would be the biggest of them all!
835325773313617920,2017-02-25 03:09:18,FAKE NEWS media knowingly doesn't tell the truth. A great danger to our country. The failing @nytimes has become a joke. Likewise @CNN. Sad!
835124487150571520,2017-02-24 13:49:28,Going to CPAC!
835106144993542148,2017-02-24 12:36:35,find the leakers within the FBI itself. Classified information is being given to media that could have a devastating effect on U.S. FIND NOW
835104947595259905,2017-02-24 12:31:49,"The FBI is totally unable to stop the national security ""leakers"" that have permeated our government for a long time. They can't even......"
834917442052894721,2017-02-24 00:06:44,Big interview tonight by Henry Kravis at The Business Council of Washington. Looking forward to it!
834916168557264900,2017-02-24 00:01:41,Seven people shot and killed yesterday in Chicago. What is going on there - totally out of control. Chicago needs help!
834384984228114434,2017-02-22 12:50:57,Very much enjoyed my tour of the Smithsonian's National Museum of African American History and Culture...A great job done by amazing people!
834377366738714625,2017-02-22 12:20:40,"One thing I will say about Rep. Keith Ellison, in his fight to lead the DNC, is that he was the one who predicted early that I would win!"
834181714536706049,2017-02-21 23:23:13,"The so-called angry crowds in home districts of some Republicans are actually, in numerous cases, planned out by liberal activists. Sad!"
833783440587780096,2017-02-20 21:00:37,Just named General H.R. McMaster National Security Advisor.
833761538972475401,2017-02-20 19:33:36,Meeting with Generals at Mar-a-Lago in Florida. Very interesting!
833686032231051264,2017-02-20 14:33:33,HAPPY PRESIDENTS DAY - MAKE AMERICA GREAT AGAIN!
833681541825953792,2017-02-20 14:15:43,Give the public a break - The FAKE NEWS media is trying to say that large scale immigration in Sweden is working out just beautifully. NOT!
833435246506938368,2017-02-19 21:57:01,My statement as to what's happening in Sweden was in reference to a story that was broadcast on @FoxNews concerning immigrants &amp;amp; Sweden.
833050083323154432,2017-02-18 20:26:31,"Getting ready to leave for Melbourne, Florida. See you all soon!"
832950630524284928,2017-02-18 13:51:20,"Will be having many meetings this weekend at The Southern White House. Big 5:00 P.M. speech in Melbourne, Florida. A lot to talk about!"
832945739282128897,2017-02-18 13:31:54,Don't believe the main stream (fake news) media.The White House is running VERY WELL. I inherited a MESS and am in the process of fixing it.
832742167080816640,2017-02-18 00:02:58,Looking forward to the Florida rally tomorrow. Big crowd expected!
832730329412726784,2017-02-17 23:15:56,"""One of the most effective press conferences I've ever seen!"" says Rush Limbaugh. Many agree.Yet FAKE MEDIA  calls it differently! Dishonest"
832708295664087040,2017-02-17 21:48:23,"The FAKE NEWS media (failing @nytimes, @NBCNews, @ABC, @CBS, @CNN) is not my enemy, it is the enemy of the American People!"
832704294960889856,2017-02-17 21:32:29,"The FAKE NEWS media (failing @nytimes, @CNN, @NBCNews and many more)    is not my enemy, it is the enemy of the American people. SICK!"
832555989081714689,2017-02-17 11:43:10,Thank you for all of the nice statements on the Press Conference yesterday. Rush Limbaugh said one of greatest ever. Fake media not happy!
832554774448971777,2017-02-17 11:38:21,"Going to Charleston, South Carolina, in order to spend time with Boeing and talk jobs! Look forward to it."
832533431871496192,2017-02-17 10:13:32,"Despite the long delays by the Democrats in finally approving Dr. Tom Price, the repeal and replacement of ObamaCare is moving fast!"
832238072100188162,2017-02-16 14:39:53,"The Democrats had to come up with a story as to why they lost the election, and so badly (306), so they made up a story - RUSSIA. Fake news!"
832230759683518465,2017-02-16 14:10:49,"FAKE NEWS media, which makes up stories and ""sources,"" is far more effective than the discredited Democrats - but they are fading fast!"
832198589564801025,2017-02-16 12:02:59,The spotlight has finally been put on the low-life leakers! They will be caught!
832197516808560640,2017-02-16 11:58:44,"Leaking, and even illegal classified leaking, has been a big problem in Washington for years. Failing @nytimes (and others) must apologize!"
832191486859104256,2017-02-16 11:34:46,Stock market hits new high with longest winning streak in decades. Great level of confidence and optimism - even before tax plan rollout!
831853863649079296,2017-02-15 13:13:10,"The real scandal here is that classified information is illegally given out by ""intelligence"" like candy. Very un-American!"
831846102806691841,2017-02-15 12:42:20,Crimea was TAKEN by Russia during the Obama Administration. Was Obama too soft on Russia?
831837515703255040,2017-02-15 12:08:13,This Russian connection non-sense is merely an attempt to cover-up the many mistakes made in Hillary Clinton's losing campaign.
831510533765529600,2017-02-14 14:28:54,The real story here is why are there so many illegal leaks coming out of Washington? Will these leaks be happening as I deal on N.Korea etc?
830904084853039104,2017-02-12 22:19:05,Just leaving Florida. Big crowds of enthusiastic supporters lining the road that the FAKE NEWS media refuses to mention. Very dishonest!
830769248511336449,2017-02-12 13:23:18,I know Mark Cuban well. He backed me big-time but I wasn't interested in taking all of his calls.He's not smart enough to run for president!
830764597619601408,2017-02-12 13:04:49,"After two days of very productive talks, Prime Minister Abe is heading back to Japan. L"
830751876882825217,2017-02-12 12:14:16,"While on FAKE NEWS @CNN, Bernie Sanders was cut off for using the term fake news to describe the network. They said technical difficulties!"
830741933832159232,2017-02-12 11:34:46,"The crackdown on illegal criminals is merely the keeping of my campaign promise. Gang members, drug dealers &amp;amp; others are being removed!"
830558067171405825,2017-02-11 23:24:08,"A working dinner tonight with Prime Minister Abe of Japan, and his representatives, at the Winter White House (Mar-a-Lago). Very good talks!"
830553971873939461,2017-02-11 23:07:52,"Playef golf today with Prime Minister Abe of Japan and @TheBig_Easy, Ernie Els, and had a great time. Japan is very well represented!"
830552080863621124,2017-02-11 23:00:21,"I am so proud of my daughter Ivanka. To be abused and treated so badly by the media, and to still hold her head so high, is truly wonderful!"
830409524196556800,2017-02-11 13:33:53,"Melania and I are hosting Japanese Prime Minister Shinzo Abe and Mrs. Abe at Mar-a-Lago in Palm Beach, Fla. They are a wonderful couple!"
830407174178353154,2017-02-11 13:24:33,"...design or negotiations yet. When I do, just like with the F-35 FighterJet or the Air Force One Program, price will come WAY DOWN!"
830405707832913921,2017-02-11 13:18:43,"I am reading that the great border WALL will cost more than the government originally thought, but I have not gotten involved in the....."
830389132035768320,2017-02-11 12:12:51,"Our legal system is broken! ""77% of refugees allowed into U.S. since travel reprieve hail from seven suspect countries."" (WT)  SO DANGEROUS!"
830047627827884032,2017-02-10 13:35:50,"The failing @nytimes does major FAKE NEWS China story saying ""Mr.Xi has not spoken to Mr. Trump since Nov.14."" We spoke at length yesterday!"
830042500689690624,2017-02-10 13:15:28,"LAWFARE: ""Remarkably, in the entire opinion, the panel did not bother even to cite this (the) statute."" A disgraceful decision!"
829836233169915904,2017-02-09 23:35:50,"SEE YOU IN COURT, THE SECURITY OF OUR NATION IS AT STAKE!"
829689437693042688,2017-02-09 13:52:31,"..Ryan died on a winning mission ( according to General Mattis), not a ""failure."" Time for the U.S. to get smart and start winning again!"
829684273590501376,2017-02-09 13:32:00,"...long he doesn't know how to win anymore, just look at the mess our country is in - bogged down in conflict all over the place. Our hero.."
829682796084023296,2017-02-09 13:26:08,Sen. McCain should not be talking about the success or failure of a mission to the media. Only emboldens the enemy! He's been losing so....
829681035831025664,2017-02-09 13:19:08,"Chris Cuomo, in his interview with Sen. Blumenthal, never asked him about his long-term lie about his brave ""service"" in Vietnam. FAKE NEWS!"
829660614222036992,2017-02-09 11:57:59,"Sen.Richard Blumenthal, who never fought in Vietnam when he said for years he had (major lie),now misrepresents what Judge Gorsuch told him?"
829384588795531267,2017-02-08 17:41:09,"Big increase in traffic into our country from certain areas, while our people are far more vulnerable, as we wait for what should be EASY D!"
829315037655400451,2017-02-08 13:04:47,"I will be speaking at 9:00 A.M. today to Police Chiefs and Sheriffs and will be discussing the horrible, dangerous and wrong decision......."
829299567933976576,2017-02-08 12:03:19,"If the U.S. does not win this case as it so obviously should, we can never have the security and safety to which we are entitled. Politics!"
829133646305058816,2017-02-08 01:04:00,"It is a disgrace that my full Cabinet is still not in place, the longest such delay in the history of our country. Obstruction by Democrats!"
828937358703730688,2017-02-07 12:04:01,"I don't know Putin, have no deals in Russia, and the haters are going crazy - yet Obama can make a deal with Iran, #1in terror, no problem!"
828797802901864448,2017-02-07 02:49:29,"The threat from radical Islamic terrorism is very real, just look at what is happening in Europe and the Middle-East. Courts must act fast!"
828793888622178304,2017-02-07 02:33:55,The failing @nytimes was forced to apologize to its subscribers for the poor reporting it did on my election win. Now they are worse!
828641341949243392,2017-02-06 16:27:45,Will be interviewed on @oreillyfactor tonight at 8:00 P.M.
828575950514376705,2017-02-06 12:07:55,"I call my own shots, largely based on an accumulation of data, and everyone knows it. Some FAKE NEWS media, in order to marginalize, lies!"
828574432234991617,2017-02-06 12:01:53,"Any negative polls are fake news, just like the CNN, ABC, NBC polls in the election. Sorry, people want border security and extreme vetting."
828447351723397121,2017-02-06 03:36:55,"What an amazing comeback and win by the Patriots. Tom Brady, Bob Kraft and Coach B are total winners. Wow!"
828375074327654400,2017-02-05 22:49:42,Enjoy the #SuperBowl and then we continue: MAKE AMERICA GREAT AGAIN!
828344302686318592,2017-02-05 20:47:26,I will be interviewed by @oreillyfactor at 4:00 P.M. (prior to the #SuperBowl Pre-game Show) on Fox Network. Enjoy!
828343074266963968,2017-02-05 20:42:33,I have instructed Homeland Security to check people coming into our country VERY CAREFULLY. The courts are making the job very difficult!
828342203776909313,2017-02-05 20:39:05,Just cannot  believe a judge would put our country in such peril. If something happens blame him and court system. People pouring in. Bad!
828042508231987200,2017-02-05 00:48:12,The judge opens up our country to potential terrorists and others that do not have our best interests at heart. Bad people are very happy!
828039144718884866,2017-02-05 00:34:50,Interview with @oreillyfactor on Fox Network - 4:00 P.M. (prior to Super Bowl). Enjoy!
828024836949688320,2017-02-04 23:37:59,"Why aren't the lawyers looking at and using the Federal Court decision in Boston, which is at conflict with ridiculous lift ban decision?"
827996358476972040,2017-02-04 21:44:49,"Because the ban was lifted by a judge, many very bad and dangerous people may be pouring into our country. A terrible decision"
827981080422645760,2017-02-04 20:44:07,"What is our country coming to when a judge can halt a Homeland Security travel ban and anyone, even with bad intentions, can come into U.S.?"
827885967797268482,2017-02-04 14:26:10,MAKE AMERICA GREAT AGAIN!
827874209166659584,2017-02-04 13:39:27,"After being forced to apologize for its bad and inaccurate coverage of me after winning the election, the FAKE NEWS @nytimes is still lost!"
827867312384520193,2017-02-04 13:12:02,"The opinion of this so-called judge, which essentially takes law-enforcement away from our country, is ridiculous and will be overturned!"
827715247846936577,2017-02-04 03:07:47,Countries charge U.S. companies taxes or tariffs while the U.S. charges them nothing or little.We should charge them SAME as they charge us!
827655064546312192,2017-02-03 23:08:39,"We must keep ""evil"" out of our country!"
827499872483938304,2017-02-03 12:51:58,A new radical Islamic terrorist has just attacked in Louvre Museum in Paris. Tourists were locked down. France on edge again. GET SMART U.S.
827483845490573312,2017-02-03 11:48:17,"Professional anarchists, thugs and paid protesters are proving the point of the millions of people who voted to MAKE AMERICA GREAT AGAIN!"
827482061133008896,2017-02-03 11:41:11,"Meeting with biggest business leaders this morning. Good jobs are coming back to U.S., health care and tax bills are being crafted NOW!"
827480387660181506,2017-02-03 11:34:32,Thank you to Prime Minister of Australia for telling the truth about our very civil conversation that FAKE NEWS media lied about. Very nice!
827478753517395969,2017-02-03 11:28:03,"Iran is playing with fire - they don't appreciate how ""kind"" President Obama was to them. Not me!"
827477948873728000,2017-02-03 11:24:51,"Yes, Arnold Schwarzenegger did a really bad job as Governor of California and even worse on the Apprentice...but at least he tried hard!"
827119327996436480,2017-02-02 11:39:49,Iran was on its last legs and ready to collapse until the U.S. came along and gave it a life-line in the form of the Iran Deal: $150 billion
827118014164303872,2017-02-02 11:34:36,Iran has been formally PUT ON NOTICE for firing a ballistic missile.Should have been thankful for the terrible deal the U.S. made with them!
827115769884508160,2017-02-02 11:25:41,Attending Chief Ryan Owens' Dignified Transfer yesterday with my daughter Ivanka was my great honor. To a great and brave man - thank you!
827113927700000768,2017-02-02 11:18:22,Congratulations to Rex Tillerson on being sworn in as our new Secretary of State. He will be a star!
827112634549927938,2017-02-02 11:13:13,If U.C. Berkeley does not allow free speech and practices violence on innocent people with a different point of view - NO FEDERAL FUNDS?
827002560217247744,2017-02-02 03:55:49,Do you believe it? The Obama Administration agreed to take thousands of illegal immigrants from Australia. Why? I will study this dumb deal!
826990081344937984,2017-02-02 03:06:14,Iran is rapidly taking over more and more of Iraq even after the U.S. has squandered three trillion dollars there. Obvious long ago!
826774670498217986,2017-02-01 12:50:16,"Everybody is arguing whether or not it is a BAN. Call it what you want, it is about keeping bad people (with bad intentions) out of country!"
826637558377545731,2017-02-01 03:45:26,"Hope you like my nomination of Judge Neil Gorsuch for the United States Supreme Court. He is a good and brilliant man, respected by all."
826588659805728769,2017-02-01 00:31:08,Getting ready to deliver a VERY IMPORTANT DECISION!  8:00 P.M.
826391335414484992,2017-01-31 11:27:02,When will the Democrats give us our Attorney General and rest of Cabinet! They should be ashamed of themselves! No wonder D.C. doesn't work!
826390035989659649,2017-01-31 11:21:52,Nancy Pelosi and Fake Tears Chuck Schumer held a rally  at the steps of The Supreme Court and mic did not work (a mess)-just like Dem party!
826229972947836932,2017-01-31 00:45:50,The Democrats are delaying my cabinet picks for purely political reasons. They have nothing going but to obstruct. Now have an Obama A.G.
826063269265825792,2017-01-30 13:43:25,I have made my decision on who I will nominate for The United States Supreme Court. It will be announced live on Tuesday at 8:00 P.M. (W.H.)
826060145360830464,2017-01-30 13:31:00,"If the ban were announced with a one week notice, the ""bad"" would rush into our country during that week. A lot of bad ""dudes"" out there!"
826044061199040513,2017-01-30 12:27:06,There is nothing nice about searching for terrorists before they can enter our country. This was a big part of my campaign. Study the world!
826042485155704832,2017-01-30 12:20:50,protesters and the tears of Senator Schumer. Secretary Kelly said that all is going well with very few problems. MAKE AMERICA SAFE AGAIN!
826041399002947584,2017-01-30 12:16:31,"Only 109 people out of 325,000 were detained and held for questioning. Big problems at airports were caused by Delta computer outage,....."
825823218355286017,2017-01-29 21:49:32,"...Senators should focus their energies on ISIS, illegal immigration and border security instead of always looking to start World War III."
825721154597945344,2017-01-29 15:03:59,Christians in the Middle-East have been executed in large numbers. We cannot allow this horror to continue!
825692048686739460,2017-01-29 13:08:19,"Our country needs strong borders and extreme vetting, NOW. Look what is happening all over Europe and, indeed, the world - a horrible mess!"
825690089720254466,2017-01-29 13:00:32,Somebody with aptitude and conviction should buy the FAKE NEWS and failing @nytimes and either run it correctly or let it fold with dignity!
825331667187400708,2017-01-28 13:16:18,"...dwindling subscribers and readers.They got me wrong right from the beginning and still have not changed course, and never will. DISHONEST"
825329759299203074,2017-01-28 13:08:43,Thr coverage about me in the @nytimes and the @washingtonpost gas been so false and angry that the times actually apologized to its.....
825328819728965632,2017-01-28 13:04:59,"The failing @nytimes has been wrong about me from the very beginning. Said I would lose the primaries, then the general election. FAKE NEWS!"
824970004726763520,2017-01-27 13:19:10,"Mexico has taken advantage of the U.S. for long enough. Massive trade deficits &amp;amp; little help on the very weak border must change, NOW!"
824968423495127041,2017-01-27 13:12:53,"Look forward to seeing final results of VoteStand. Gregg Phillips and crew say at least 3,000,000 votes were illegal. We must do better!"
824616645608009728,2017-01-26 13:55:03,"of jobs and companies lost. If Mexico is unwilling to pay for the badly needed wall, then it would be better to cancel the upcoming meeting."
824615822052225024,2017-01-26 13:51:47,The U.S. has a 60 billion dollar trade deficit with Mexico. It has been a one-sided deal from the beginning of NAFTA with massive numbers...
824573700032884736,2017-01-26 11:04:24,"Ungrateful TRAITOR Chelsea Manning, who should never have been released from prison, is now calling President Obama a weak leader. Terrible!"
824448882268577792,2017-01-26 02:48:25,Interview with David Muir of @ABC News in 10 minutes. Enjoy!
824448158411452416,2017-01-26 02:45:33,"""@romoabcnews: .@DavidMuir first @POTUS interview since taking office.  Tonight on @ABCWorldNews @ABC2020 tonight. https://t.co/jejkBnBPp5"""
824229587374772224,2017-01-25 12:17:01,I will be making my Supreme Court pick on Thursday of next week.Thank you!
824228769527459841,2017-01-25 12:13:46,"even, those registered to vote who are dead (and many for a long time). Depending on results, we will strengthen up voting procedures!"
824227826467565568,2017-01-25 12:10:01,"I will be asking for a major investigation into VOTER FRAUD, including those registered to vote in two states, those who are illegal and...."
824083823130505217,2017-01-25 02:37:48,"Big day planned on NATIONAL SECURITY tomorrow. Among many other things, we will build the wall!"
824082963285602305,2017-01-25 02:34:23,"Big day planned on national security for tomorrow! Amoung many other things, we will build the wall."
