id,created_at,text
810109133068369921,2016-12-17 13:07:23,"""@EazyMF_E: @realDonaldTrump Many people are now saying you will be an extremely successful president! #MakeAmericaGreatAgain""  Thank you!"
810108544313917441,2016-12-17 13:05:02,"Last night in Orlando, Florida, was incredible - massive crowd - THANK YOU FLORIDA! Today at 3:00 P.M. I will be in Alabama for last rally!"
810099767506305025,2016-12-17 12:30:10,China steals United States Navy research drone in international waters - rips it out of water and takes it to China in unpresidented act.
809717036662358016,2016-12-16 11:09:20,Are we talking about the same cyberattack where it was revealed that head of the DNC illegally gave Hillary the questions to the debate?
809392492927975425,2016-12-15 13:39:42,"If Russia, or some other entity, was hacking, why did the White House waite so long to act? Why did they only complain after Hillary lost?"
809389775694209024,2016-12-15 13:28:54,"The media tries so hard to make my move to the White House, as it pertains to my business, so complex - when actually it isn't!"
809384827497619456,2016-12-15 13:09:15,"Thank you to Time Magazine and Financial Times for naming me ""Person of the Year"" - a great honor!"
809383990587179008,2016-12-15 13:05:55,"Has anyone looked at the really poor numbers of @VanityFair Magazine. Way down, big trouble, dead! Graydon Carter, no talent, will be out!"
808653725468360704,2016-12-13 12:44:06,The thing I like best about Rex Tillerson is that he has vast experience at dealing successfully with all types of foreign governments.
808642020264841216,2016-12-13 11:57:36,Wisconsin and Pennsylvania have just certified my wins in those states. I actually picked up additional votes!
808638508332093440,2016-12-13 11:43:38,"I have chosen one of the truly great business leaders of the world, Rex Tillerson, Chairman and CEO of ExxonMobil, to be Secretary of State."
808532288535465984,2016-12-13 04:41:34,"I will hold a press conference in the near future to discuss the business, Cabinet picks and all other topics of interest. Busy times!"
808529889787842560,2016-12-13 04:32:02,"Presidency. Two of my children, Don and Eric, plus executives, will manage them. No new deals will be done during my term(s) in office."
808528429599571969,2016-12-13 04:26:14,"Even though I am not mandated by law to do so, I will be leaving my busineses before January 20th so that I can focus full time on the......"
808469757204852737,2016-12-13 00:33:05,I will be making my announcement on the next Secretary of State tomorrow morning.
808456603523543040,2016-12-12 23:40:49,The final Wisconsin vote is in and guess what - we just picked up an additional 131 votes. The Dems and Green Party can now rest. Scam!
808114705583767552,2016-12-12 01:02:14,"Just watched @NBCNightlyNews - So biased, inaccurate and bad, point after point. Just can't get much worse, although @CNN is right up there!"
808107216691728385,2016-12-12 00:32:29,Will be interviewed on @FoxNews at 10:00 P.M. Enjoy!
807945984240209920,2016-12-11 13:51:48,"I spent Friday campaigning with John Kennedy, of the Great State of Louisiana, for the U.S.Senate. The election is over - JOHN WON!"
807935996713168896,2016-12-11 13:12:06,"Being at the Army - Navy Game was fantastic. There is nothing like the spirit in that stadium. A wonderful experience, and congrats to Army!"
807932021762822145,2016-12-11 12:56:19,I will be interviewed today on Fox News Sunday with Chris Wallace at 10:00 (Eastern) Network. ENJOY!
807565128468230144,2016-12-10 12:38:25,"As a show of support for our Armed Forces, I will be going to The Army-Navy Game today. Looking forward to it, should be fun!"
807549463615127553,2016-12-10 11:36:10,"Reports by @CNN that I will be working on The Apprentice during my Presidency, even part time, are rediculous &amp;amp; untrue - FAKE NEWS!"
807545245466562560,2016-12-10 11:19:24,".@RudyGiuliani, one of the finest people I know and a former GREAT Mayor of N.Y.C., just took himself out of consideration for ""State""."
806678855280902147,2016-12-08 01:56:41,"If United Steelworkers 1999 was any good, they would have kept those jobs in Indiana. Spend more time working-less time talking. Reduce dues"
806660013498527744,2016-12-08 00:41:48,"Chuck Jones, who is President of United Steelworkers 1999, has done a terrible job representing workers. No wonder companies flee country!"
806473066612215812,2016-12-07 12:18:57,I will be interviewed on the @TODAYshow at 7:30. Enjoy!
806134245861261313,2016-12-06 13:52:36,"Boeing is building a brand new 747 Air Force One for future presidents, but costs are out of control, more than $4 billion. Cancel order!"
805539772441776128,2016-12-04 22:30:22,their country (the U.S. doesn't tax them) or to build a massive military complex in the middle of the South China Sea?  I don't think so!
805538150613454849,2016-12-04 22:23:55,"Did China ask us if it was OK to devalue their currency (making it hard for our companies to compete), heavily tax our products going into.."
805528948645969924,2016-12-04 21:47:22,".@FoxNews will be re-running ""Objectified: Donald Trump,"" the ratings hit produced by the great Harvey Levin of TMZ, at 8:00 P.M. Enjoy!"
805486511563149313,2016-12-04 18:58:44,The Green Party just dropped its recount suit in Pennsylvania and is losing votes in Wisconsin recount. Just a Stein scam to raise money!
805387039415922688,2016-12-04 12:23:28,expensive mistake! THE UNITED STATES IS OPEN FOR BUSINESS
805386424484827136,2016-12-04 12:21:01,"these companies are able to move between all 50 states, with no tax or tariff being charged. Please be forewarned prior to making a very ..."
805382542853599233,2016-12-04 12:05:36,"wanting to sell their product, cars, A.C. units etc., back across the border. This tax will make leaving financially difficult, but....."
805380554602463232,2016-12-04 11:57:42,"without retribution or consequence, is WRONG! There will be a tax on our soon to be strong border of 35% for these companies ......"
805378394888294404,2016-12-04 11:49:07,"fires its employees, builds a new factory or plant in the other country, and then thinks it will sell its product back into the U.S.  ......"
805376550426316801,2016-12-04 11:41:47,"The U.S. is going to substantialy reduce taxes and regulations on businesses, but any business that leaves our country for another country,"
805278956610060288,2016-12-04 05:13:59,"Just tried watching Saturday Night Live - unwatchable! Totally biased, not funny and the Baldwin impersonation just can't get any worse. Sad"
805088571661094912,2016-12-03 16:37:27,"""@TigerWoods: Can’t wait to get back out there and mix it up with the boys. –TW #heroworldchallenge"" Great to have you back Tiger - Special!"
804884533971681280,2016-12-03 03:06:41,Rexnord of Indiana is moving to Mexico and rather viciously firing all of its 300 workers. This is happening all over our country. No more!
804863099677380608,2016-12-03 01:41:31,Interesting how the U.S. sells Taiwan billions of dollars of military equipment but I should not accept a congratulatory call.
804848713000747008,2016-12-03 00:44:21,The President of Taiwan CALLED ME today to wish me congratulations on winning the Presidency. Thank you!
804333772510478336,2016-12-01 14:38:09,Getting ready to leave for the Great State of Indiana and meet the hard working and wonderful people of Carrier A.C.
804170302385246208,2016-12-01 03:48:35,Look forward to going to Indiana tomorrow in order to be with the great workers of Carrier. They will sell many air conditioners!
803931491952631808,2016-11-30 11:59:38,"Hence, legal documents are being crafted which take me completely out of business operations. The Presidency is a far more important task!"
803930242079461376,2016-11-30 11:54:40,"do this under the law, I feel it is visually important, as President,  to in no way have a conflict of interest with my various businesses.."
803927776524898304,2016-11-30 11:44:52,great business in total in order to fully focus on running the country in order to MAKE AMERICA GREAT AGAIN! While I am not mandated to ....
803926490094170113,2016-11-30 11:39:46,I will be holding a major news conference in New York City with my children on December 15 to discuss the fact that I will be leaving my ...
803921524235370496,2016-11-30 11:20:02,ISIS is taking credit for the terrible stabbing attack at Ohio State University by a Somali refugee who should not have been in our country.
803808456390176768,2016-11-30 03:50:44,Big day on Thursday for Indiana and the great workers of that wonderful state.We will keep our companies and jobs in the U.S. Thanks Carrier
803805825093500928,2016-11-30 03:40:17,I will be going to Indiana on Thursday to make a major announcement concerning Carrier A.C. staying in Indianapolis. Great deal for workers!
803567994995490816,2016-11-29 11:55:14,"Nobody should be allowed to burn the American flag - if they do, there must be consequences - perhaps loss of citizenship or year in jail!"
803562829337001984,2016-11-29 11:34:42,"I thought that @CNN would get better after they failed so badly in their support of Hillary Clinton however, since election, they are worse!"
803558078469836800,2016-11-29 11:15:49,The Great State of Michigan was just certified as a Trump WIN giving all of our MAKE AMERICA GREAT AGAIN supporters another victory - 306!
803434302310584320,2016-11-29 03:03:59,".@CNN is so embarrassed by their total  (100%) support of Hillary Clinton, and yet her loss in a landslide, that they don't know what to do."
803423504687333378,2016-11-29 02:21:05,"""@sdcritic:  @HighonHillcrest @jeffzeleny @CNN There is NO QUESTION THAT #voterfraud did take place, and in favor of #CorruptHillary !"""
803423205197234178,2016-11-29 02:19:53,"""@FiIibuster: @jeffzeleny Pathetic - you have no sufficient evidence that Donald Trump did not suffer from voter fraud, shame! Bad reporter."
803422201403834368,2016-11-29 02:15:54,"""@JoeBowman12: @jeffzeleny just another generic CNN part time wannabe journalist !""  @CNN still doesn't get it. They will never learn!"
803421744228958208,2016-11-29 02:14:05,"""@HighonHillcrest: @jeffzeleny what PROOF do u have DonaldTrump did not suffer from millions of FRAUD votes? Journalist? Do your job! @CNN"""
803237536600649728,2016-11-28 14:02:06,"If Cuba is unwilling to make a better deal for the Cuban people, the Cuban/American people and the U.S. as a whole, I will terminate deal."
803033643887263744,2016-11-28 00:31:55,"Serious voter fraud in Virginia, New Hampshire and California - so why isn't the media reporting on this? Serious bias - big problem!"
802975668850008069,2016-11-27 20:41:32,states instead of the 15 states that I visited. I would have won even more easily and convincingly (but smaller states are forgotten)!
802973849721704448,2016-11-27 20:34:18,It would have been much easier for me to win the so-called popular vote than the Electoral College in that I would only campaign in 3 or 4--
802972945828184064,2016-11-27 20:30:43,"In addition to winning the Electoral College in a landslide, I won the popular vote if you deduct the millions of people who voted illegally"
802866943065812992,2016-11-27 13:29:30,"Trump is going to be our President. We owe him an open mind and the chance to lead."" So much time and money will be spent - same result! Sad"
802865384185622532,2016-11-27 13:23:18,"this election. That is a direct threat to our democracy."" She then said, ""We have to accept the results and look to the future, Donald --"
802864077370519552,2016-11-27 13:18:07,"of position."" Then, separately she stated, ""He said something truly horrifying ... he refused to say that he would respect the results of --"
802861555322933252,2016-11-27 13:08:05,"during a general election. I, for one, am appalled that somebody that is the nominee of one of our two major parties would take that kind --"
802859804343418880,2016-11-27 13:01:08,"and fair elections. We've accepted the outcomes when we may not have liked them, and that is what must be expected of anyone standing on a -"
802858274961833988,2016-11-27 12:55:03,"Hillary's debate answer on delay: ""That is horrifying. That is not the way our democracy works. Been around for 240 years. We've had free --"
802849332563214342,2016-11-27 12:19:31,Hillary Clinton conceded the election when she called me just prior to the victory speech and after the results were in. Nothing will change
802723591196438528,2016-11-27 03:59:52,"The Democrats, when they incorrectly thought they were going to win, asked that the election night tabulation be accepted. Not so anymore!"
802499194128830464,2016-11-26 13:08:12,Fidel Castro is dead!
801805566062579712,2016-11-24 15:11:58,"I am working hard, even on Thanksgiving, trying to get Carrier A.C. Company to stay in the U.S. (Indiana). MAKING PROGRESS - Will know soon!"
801629063475560449,2016-11-24 03:30:36,"Happy Thanksgiving to everyone. We will, together, MAKE AMERICA GREAT AGAIN!"
801029196516462592,2016-11-22 11:46:57,Great meetings will take place today at Trump Tower concerning the formation of the people who will run our government for the next 8 years.
801026637282168832,2016-11-22 11:36:47,The failing @nytimes just announced that complaints about them are at a 15 year high. I can fully understand that - but why announce?
801025258245472256,2016-11-22 11:31:18,Perhaps a new meeting will be set up with the @nytimes. In the meantime they continue to cover me inaccurately and with a nasty tone!
801021598006267904,2016-11-22 11:16:45,I cancelled today's meeting with the failing @nytimes when the terms and conditions of the meeting were changed at the last moment. Not nice
800887089353068544,2016-11-22 02:22:16,Many people would like to see @Nigel_Farage represent Great Britain as their Ambassador to the United States. He would do a great job!
800885099633905665,2016-11-22 02:14:22,Prior to the election it was well known that I have interests in properties all over the world.Only the crooked media makes this a big deal!
800339167460859904,2016-11-20 14:05:01,I have always had a good relationship with Chuck Schumer. He is far smarter than Harry R and has the ability to get things done. Good news!
800338104196268032,2016-11-20 14:00:48,"I have always had a good relationship with Chuck Shumer. He is much smarter than Harry R, and actually, far more cunning - gets things done!"
800332641262272512,2016-11-20 13:39:05,"General James ""Mad Dog"" Mattis, who is being considered for Secretary of Defense, was very impressive yesterday. A true General's General!"
800329366605627393,2016-11-20 13:26:05,"I watched parts of @nbcsnl Saturday Night Live last night. It is a totally one-sided, biased show - nothing funny at all. Equal time for us?"
800303778356338688,2016-11-20 11:44:24,Numerous patriots will be coming to Bedminster today as I continue to fill out the various positions necessary to MAKE AMERICA GREAT AGAIN!
800298287811039233,2016-11-20 11:22:35,"The cast and producers of Hamilton, which I hear is highly overrated, should immediately apologize to Mike Pence for their terrible behavior"
800134633140563968,2016-11-20 00:32:16,Very rude and insulting of Hamilton cast member to treat our great future V.P. Mike Pence to a theater lecture.Couldn't even memorize lines!
800097381027106816,2016-11-19 22:04:15,..@FoxNews at 8:00 tonight. Enjoy!
799974636846886912,2016-11-19 13:56:30,"The Theater must always be a safe and special place.The cast of Hamilton was very rude last night to a very good man, Mike Pence. Apologize!"
799972626533859328,2016-11-19 13:48:31,"Our wonderful future V.P. Mike Pence was harassed last night at the theater by the cast of Hamilton, cameras blazing.This should not happen!"
799970373420937216,2016-11-19 13:39:34,The ONLY bad thing about winning the Presidency is that I did not have the time to go through a long but winning trial on Trump U. Too bad!
799969132175392768,2016-11-19 13:34:38,I settled the Trump University lawsuit for a small fraction of the potential award because as President I have to focus on our country.
799788838575112192,2016-11-19 01:38:13,.@FoxNews tonight at TEN! Enjoy!
799742849113849856,2016-11-18 22:35:28,Will be working all weekend in choosing the great men and women who will be helping to MAKE AMERICA GREAT AGAIN!
799435826157547520,2016-11-18 02:15:28,I worked hard with Bill Ford to keep the Lincoln plant in Kentucky. I owed it to the great State of Kentucky for their confidence in me!
799432405329252352,2016-11-18 02:01:52,"Just got a call from my friend Bill Ford, Chairman of Ford, who advised me that he will be keeping the Lincoln plant in Kentucky - no Mexico"
799232217004339201,2016-11-17 12:46:24,"My transition team, which is working long hours and doing a fantastic job, will be seeing many great candidates today. #MAGA"
798864535612440576,2016-11-16 12:25:22,"Australia, New Zealand, and more. I am always available to them. @nytimes is just upset that they looked like fools in their coverage of me."
798862484912427008,2016-11-16 12:17:13,"I have recieved and taken calls from many foreign leaders despite what the failing @nytimes said. Russia, U.K., China, Saudi Arabia, Japan,"
798861302420635648,2016-11-16 12:12:31,"The failing @nytimes story is so totally wrong on transition. It is going so smoothly. Also, I have spoken to many foreign leaders."
798850340833529858,2016-11-16 11:28:57,"I am not trying to get ""top level security clearance"" for my children. This was a typically false news story."
798721144153108485,2016-11-16 02:55:34,Very organized process taking place as I decide on Cabinet and many other positions. I am the only one who knows who the finalists are!
798521054952099840,2016-11-15 13:40:29,"The Electoral College is actually genius in that it brings all states, including the smaller ones, into play. Campaigning is much different!"
798519602128961536,2016-11-15 13:34:43,If the election were based on total popular vote I would have campaigned in  N.Y. Florida and California and won even bigger and more easily
797871544223440896,2016-11-13 18:39:34,"The debates, especially the second and third, plus speaches and intensity of the large rallies, plus OUR GREAT SUPPORTERS, gave us the win!"
797839803148603393,2016-11-13 16:33:26,I will be interviewed on @60Minutes tonight after the NFL game - 7:00 P.M. Enjoy!
797832231230259201,2016-11-13 16:03:21,"The @nytimes states today that DJT believes ""more countries should acquire nuclear weapons."" How dishonest are they. I never said this!"
797823554591002624,2016-11-13 15:28:52,"Governor John Kasich of the GREAT, GREAT, GREAT State of Ohio called to congratulate me on the win. The people of Ohio were incredible!"
797822194634096640,2016-11-13 15:23:28,"Jeb Bush, George W and George H.W. all called to express their best wishes on the win. Very nice!"
797812631679762433,2016-11-13 14:45:28,Mitt Romney called to congratulate me on the win. Very nice!
797812050311442433,2016-11-13 14:43:10,The @nytimes sent a letter to their subscribers apologizing for their BAD coverage of me. I wonder if it will change - doubt it?
797805408807165956,2016-11-13 14:16:46,"Wow, the @nytimes is losing thousands of subscribers because of their very poor and highly inaccurate coverage of the ""Trump phenomena"""
797455297333829632,2016-11-12 15:05:33,"This will prove to be a great time in the lives of ALL Americans. We will unite and we will win, win, win!"
797069765361725443,2016-11-11 13:33:35,Busy day planned in New York. Will soon be making some very important decisions on the people who will be running our government!
797034722589310976,2016-11-11 11:14:20,Love the fact that the small groups of protesters last night have passion for our great country. We will all come together and be proud!
796900185536274433,2016-11-11 02:19:44,"Just had a very open and successful presidential election. Now professional protesters, incited by the media, are protesting. Very unfair!"
796897929650913280,2016-11-11 02:10:46,"A fantastic day in D.C. Met with President Obama for first time. Really good meeting, great chemistry. Melania liked Mrs. O a lot!"
796315642051891200,2016-11-09 11:36:58,Such a beautiful and important evening! The forgotten man and woman will never be forgotten again. We will all come together as never before
789117933255557120,2016-10-20 14:55:51,Why didn't Hillary Clinton announce that she was inappropriately given the debate questions - she secretly used them! Crooked Hillary.
788937647179923456,2016-10-20 02:59:27,That was really exciting. Made all of my points. MAKE AMERICA GREAT AGAIN!
788342077935513600,2016-10-18 11:32:52,"""@THEREALMOGUL: 41% of American voters believe the  election could be ""stolen"" from DonaldTrump due to widespread voter fraud. - Politico"""
788100109171101696,2016-10-17 19:31:22,"New polls are good because the media has deceived the public by putting women front and center with made-up stories and lies, and got caught"
788050037611892736,2016-10-17 16:12:24,"Wow, new polls just came out from @CNN   Great numbers, especially after total media hit job. Leading Ohio 48 - 44."
788037989146460164,2016-10-17 15:24:32,"Voter fraud! Crooked Hillary Clinton even got the questions to a debate, and nobody says a word. Can you imagine if I got the questions?"
787995513459204096,2016-10-17 12:35:45,We have all got to come together and win this election. We can't have four more years of Obama (or worse!).
787995036617236480,2016-10-17 12:33:51,Of course there is large scale voter fraud happening on and before election day. Why do Republican leaders deny what is going on? So naive!
787993805475676160,2016-10-17 12:28:58,"""@RosieGray: Peter Thiel chooses now to give $1.25mil in support of Trump https://t.co/P869y2RtBr"""
787992776671715333,2016-10-17 12:24:52,"""@PrisonPlanet: Trump accuser praised him in an email as recently as April! This is all yet another hoax. https://t.co/8kOFTclCHG"" Terrible"
787991440953577472,2016-10-17 12:19:34,"""@MarkSimoneNY: Watch Joe Biden's Long History Of Grabbing, Kissing and Groping Women Who Are Cringing: https://t.co/50k4rKbDbq"""
787990504780750849,2016-10-17 12:15:51,"Can't believe these totally phoney stories, 100% made up by women (many already proven false) and pushed big time by press, have impact!"
787783829872316416,2016-10-16 22:34:36,"ALL SAFE IN ORANGE COUNTY, NORTH CAROLINA. With you all the way, will never forget. Now we have to win. Proud of you all!  @NCGOP"
787782615336189952,2016-10-16 22:29:46,Animals representing Hillary Clinton and Dems in North Carolina just firebombed our office in Orange County because we are winning @NCGOP
787760672897662984,2016-10-16 21:02:34,"Finally, in the new ABC News/Washington Post Poll, Hillary Clinton is down 11 points with WOMEN VOTERS and the election is close at 47-43!"
787758670478249984,2016-10-16 20:54:37,"Paul Ryan, a man who doesn't know how to win (including failed run four years ago), must start focusing on the budget, military, vets etc."
787756851408539649,2016-10-16 20:47:23,"The Democrats have a corrupt political machine pushing crooked Hillary Clinton. We have Paul Ryan, always fighting the Republican nominee!"
787699932522307588,2016-10-16 17:01:13,The election is absolutely being rigged by the dishonest and distorted media pushing Crooked Hillary - but also at many polling places - SAD
787632100971257856,2016-10-16 12:31:41,"Election is being rigged by the media, in a coordinated effort with the Clinton campaign, by putting stories that never happened into news!"
787618209654505472,2016-10-16 11:36:29,"Polls close, but can you believe I lost large numbers of women voters based on made up events THAT NEVER HAPPENED. Media rigging election!"
787612555099435008,2016-10-16 11:14:00,Watched Saturday Night Live hit job on me.Time to retire the boring and unfunny show. Alec Baldwin portrayal stinks. Media rigging election!
787444480559513601,2016-10-16 00:06:08,"""@davidshiloach: @realDonaldTrump Go Mr. Trump! Israel is behind you!"""
787443716122374144,2016-10-16 00:03:06,A great day in New Hampshire and Maine. Fantastic crowds and energy! #MAGA
787425147359756288,2016-10-15 22:49:19,"The failing @nytimes reporters don't even call us anymore, they just write whatever they want to write, making up sources along the way!"
787359732235374592,2016-10-15 18:29:23,Nothing ever happened with any of these women. Totally made up nonsense to steal the election. Nobody has more respect for women than me!
787267566288928769,2016-10-15 12:23:09,Hillary Clinton should have been prosecuted and should be in jail. Instead she is running for president in what looks like a rigged election
787258213670453248,2016-10-15 11:45:59,"This election is being rigged by the media pushing false and unsubstantiated charges, and outright lies, in order to elect Crooked Hillary!"
787244545629093888,2016-10-15 10:51:40,"100% fabricated and made-up charges, pushed strongly by the media and the Clinton Campaign, may poison the minds of the American Voter. FIX!"
786554519287193600,2016-10-13 13:09:45,"Why didn't the writer of the twelve year old article in People Magazine mention the ""incident"" in her story. Because it did not happen!"
786551714560282624,2016-10-13 12:58:36,The phoney story in the failing @nytimes is a TOTAL FABRICATION. Written by same people as last discredited story on woman. WATCH!
786189447926865920,2016-10-12 12:59:05,Crooked Hillary Clinton likes to talk about the things she will do but she has been there for 30 years - why didn't she do them?
786187891990986752,2016-10-12 12:52:54,Very little pick-up by the dishonest media of incredible information provided by Wikileakes. So dishonest! Rigged system!
